{
  "required" : true ,
  "$schema" : "http://json-schema.org/draft-03/schema" ,
  "type" : "object" ,
  "properties" : {
    "id" : {
      "type" : "string" ,
      "required" : false
    } ,
    "from" : {
      "type" : "number" ,
      "required" : false
    } ,
    "to" : {
      "type" : "number" ,
      "required" : false
    } ,
    "amount" : {
      "type" : "number" ,
      "required" : false
    } ,
    "status" : {
      "type" : "string" ,
      "required" : false
    } ,
    "application" : {
      "type" : "object" ,
      "required" : false ,
      "properties" : {
        "name" : {
          "type" : "string" ,
          "required" : false
        } ,
        "canvas_name" : {
          "type" : "string" ,
          "required" : false
        } ,
        "namespace" : {
          "type" : "string" ,
          "required" : false
        } ,
        "id" : {
          "type" : "string" ,
          "required" : false
        }
      }
    } ,
    "country" : {
      "type" : "string" ,
      "required" : false
    } ,
    "created_time" : {
      "type" : "string" ,
      "required" : false
    } ,
    "updated_time" : {
      "type" : "string" ,
      "required" : false
    }
  }
}