{
  "id" : "9006187786070" ,
  "from" : 221159 ,
  "to" : 221159 ,
  "amount" : 1 ,
  "status" : "settled" ,
  "application" : {
    "name" : "SampleApp" ,
    "canvas_name" : "fbdschultzcredits" ,
    "namespace" : "fbdschultzcredits" ,
    "id" : "128163550571392"
  } ,
  "country" : "US" ,
  "created_time" : "2011-11-16T19:39:52+0000" ,
  "updated_time" : "2011-11-16T19:39:55+0000"
}